"No.","Time","Source","Destination","Protocol","Length","Info"
"566","22.580157000","172.16.1.4","172.16.1.3","TCP","74","33822 > mrt [SYN] Seq=0 Win=14600 Len=0 MSS=1460 SACK_PERM=1 TSval=3571807 TSecr=0 WS=32"
"567","22.580189000","172.16.1.3","172.16.1.4","TCP","74","mrt > 33822 [SYN, ACK] Seq=0 Ack=1 Win=14480 Len=0 MSS=1460 SACK_PERM=1 TSval=2446543 TSecr=3571807 WS=32"
"568","22.580396000","172.16.1.4","172.16.1.3","TCP","66","33822 > mrt [ACK] Seq=1 Ack=1 Win=14624 Len=0 TSval=3571807 TSecr=2446543"
"570","22.600541000","172.16.1.4","172.16.1.3","TCP","77","33822 > mrt [PSH, ACK] Seq=1 Ack=1 Win=14624 Len=11 TSval=3571812 TSecr=2446543"
"571","22.600607000","172.16.1.3","172.16.1.4","TCP","66","mrt > 33822 [ACK] Seq=1 Ack=12 Win=14496 Len=0 TSval=2446549 TSecr=3571812"
"572","22.609367000","172.16.1.3","172.16.1.4","TCP","69","mrt > 33822 [PSH, ACK] Seq=1 Ack=12 Win=14496 Len=3 TSval=2446551 TSecr=3571812"
"573","22.609482000","172.16.1.4","172.16.1.3","TCP","66","33822 > mrt [ACK] Seq=12 Ack=4 Win=14624 Len=0 TSval=3571815 TSecr=2446551"
"574","22.612701000","172.16.1.4","172.16.1.3","TCP","71","33822 > mrt [PSH, ACK] Seq=12 Ack=4 Win=14624 Len=5 TSval=3571815 TSecr=2446551"
"575","22.618034000","172.16.1.3","172.16.1.4","TCP","91","mrt > 33822 [PSH, ACK] Seq=4 Ack=17 Win=14496 Len=25 TSval=2446553 TSecr=3571815"
"577","22.657407000","172.16.1.4","172.16.1.3","TCP","66","33822 > mrt [ACK] Seq=17 Ack=29 Win=14624 Len=0 TSval=3571827 TSecr=2446553"
"627","24.621578000","172.16.1.4","172.16.1.3","TCP","71","33822 > mrt [PSH, ACK] Seq=17 Ack=29 Win=14624 Len=5 TSval=3572318 TSecr=2446553"
"628","24.622401000","172.16.1.3","172.16.1.4","TCP","91","mrt > 33822 [PSH, ACK] Seq=29 Ack=22 Win=14496 Len=25 TSval=2447054 TSecr=3572318"
"629","24.622515000","172.16.1.4","172.16.1.3","TCP","66","33822 > mrt [ACK] Seq=22 Ack=54 Win=14624 Len=0 TSval=3572318 TSecr=2447054"
"677","26.505611000","172.16.1.4","172.16.1.3","TCP","70","33822 > mrt [PSH, ACK] Seq=22 Ack=54 Win=14624 Len=4 TSval=3572789 TSecr=2447054"
"678","26.506495000","172.16.1.4","172.16.1.3","TCP","66","33822 > mrt [FIN, ACK] Seq=26 Ack=54 Win=14624 Len=0 TSval=3572789 TSecr=2447054"
"679","26.508354000","172.16.1.3","172.16.1.4","TCP","70","mrt > 33822 [PSH, ACK] Seq=54 Ack=27 Win=14496 Len=4 TSval=2447525 TSecr=3572789"
"680","26.508471000","172.16.1.4","172.16.1.3","TCP","60","33822 > mrt [RST] Seq=27 Win=0 Len=0"
