"No.","Time","Source","Destination","Protocol","Length","Info"
"416","16.579291000","172.16.1.4","172.16.1.3","TCP","74","33823 > mrt [SYN] Seq=0 Win=14600 Len=0 MSS=1460 SACK_PERM=1 TSval=3685237 TSecr=0 WS=32"
"442","17.575634000","172.16.1.4","172.16.1.3","TCP","74","33823 > mrt [SYN] Seq=0 Win=14600 Len=0 MSS=1460 SACK_PERM=1 TSval=3685487 TSecr=0 WS=32"
"493","19.579630000","172.16.1.4","172.16.1.3","TCP","74","33823 > mrt [SYN] Seq=0 Win=14600 Len=0 MSS=1460 SACK_PERM=1 TSval=3685988 TSecr=0 WS=32"
"596","23.587637000","172.16.1.4","172.16.1.3","TCP","74","33823 > mrt [SYN] Seq=0 Win=14600 Len=0 MSS=1460 SACK_PERM=1 TSval=3686990 TSecr=0 WS=32"
"797","31.595648000","172.16.1.4","172.16.1.3","TCP","74","33823 > mrt [SYN] Seq=0 Win=14600 Len=0 MSS=1460 SACK_PERM=1 TSval=3688992 TSecr=0 WS=32"
